repo_name,discussion,title,number,state,timestamp,emoji,category,Label
apache/couchdb,https://github.com/apache/couchdb/discussions/2140,Cluster does not recover from temporary network partition,2140,Unanswered,2019-08-23T21:07:48Z,🙏,Help,Conceptual
tannerlinsley/react-query,https://github.com/tannerlinsley/react-query/discussions/474,Updating a single item from the cache,474,Answered,2020-05-09T15:22:19Z,,,Review
clap-rs/clap,https://github.com/clap-rs/clap/discussions/1749,Clean up repetitive code in App definition,1749,Answered,2020-03-17T00:29:09Z,,,Review
parcel-bundler/parcel,https://github.com/parcel-bundler/parcel/discussions/4848,npm install beta release,4848,Answered,2020-07-05T15:56:15Z,,,Plans
ionic-team/capacitor,https://github.com/ionic-team/capacitor/discussions/3066,what is alternative for cordova-plugin-iosrtc in capacitor,3066,Unanswered,2020-06-07T03:28:45Z,#️⃣,General,Errors
vercel/next.js,https://github.com/vercel/next.js/discussions/13154,Flutter Support,13154,Unanswered,2020-05-20T17:38:42Z,,,Plans
xamarin/Xamarin.Forms,https://github.com/xamarin/Xamarin.Forms/discussions/11008,Failed to build my Xamarin Forms UWP project in release mode,11008,Unanswered,2020-06-10T18:15:38Z,,,Errors
prisma/prisma,https://github.com/prisma/prisma/discussions/2272,From JSON file to GraphQL API,2272,Unanswered,2020-04-22T12:50:38Z,,,Information
vercel/next.js,https://github.com/vercel/next.js/discussions/12882,SSG Error occurred prerendering page with nested node_modules,12882,Unanswered,2020-05-14T16:15:27Z,,,Errors
prisma/prisma,https://github.com/prisma/prisma/discussions/2542,optional filed with self-relation error,2542,Answered,2020-05-25T07:39:55Z,🙏,Help,Errors
vercel/next.js,https://github.com/vercel/next.js/discussions/14010,[bug routing] In production direct url like domain.com/page redirection not working,14010,Unanswered,2020-06-10T12:57:52Z,#️⃣,General,Discrepancy
dotnet/roslyn,https://github.com/dotnet/roslyn/discussions/45933,Best practice to increase build performance for large solutions,45933,Answered,2020-07-13T13:44:39Z,,,Conceptual
aws-amplify/amplify-js,https://github.com/aws-amplify/amplify-js/discussions/5414,Cannot effectively style Chatbot Component in react,5414,Unanswered,2020-04-15T10:46:05Z,,,Review
laravel/framework,https://github.com/laravel/framework/discussions/32844,Resource policy not sending paramenter,32844,Unanswered,2020-05-16T14:53:09Z,,,Errors
vercel/next.js,https://github.com/vercel/next.js/discussions/13985,Favicon Issue - Not showing (v9.4.4),13985,Answered,2020-06-10T01:29:36Z,,,Discrepancy
react-spring/react-spring,https://github.com/react-spring/react-spring/discussions/776,useTransition smooth text animation,776,Unanswered,2019-08-10T03:43:05Z,,,Discrepancy
tannerlinsley/react-table,https://github.com/tannerlinsley/react-table/discussions/2098,Unable to use select filter to view empty cells,2098,Unanswered,2020-04-03T15:53:49Z,,,Discrepancy
gulpjs/gulp,https://github.com/gulpjs/gulp/discussions/2454,"Installing gulp results in ""Failed at the node-sass@3.13.1 postinstall script.""",2454,Unanswered,2020-06-11T09:04:01Z,🙏,Help,Errors
tannerlinsley/react-query,https://github.com/tannerlinsley/react-query/discussions/451,Proposal: add setQuery function with staleTime to queryCache,451,Unanswered,2020-05-05T17:04:24Z,,,Conceptual
vercel/next.js,https://github.com/vercel/next.js/discussions/12259,Page doesn't scroll up on dynamic pages,12259,Unanswered,2020-04-27T21:34:03Z,,,Review
vercel/next.js,https://github.com/vercel/next.js/discussions/14380,next_dynamic_WEBPACK_IMPORTED_MODULE_12__defult(...) is not a function,14380,Unanswered,2020-06-20T05:29:16Z,🙏,Help,Errors
react-spring/react-spring,https://github.com/react-spring/react-spring/discussions/766,Dynamically change pages prop in Parallax. Page length changes based on content.,766,Unanswered,2019-07-29T13:59:39Z,,,Usage
octokit/rest.js,https://github.com/octokit/rest.js/discussions/1697,[TypeScript] access parameters/responses subtypes,1697,Unanswered,2020-05-02T17:10:36Z,,,Versions
vercel/next.js,https://github.com/vercel/next.js/discussions/13421,v9.4.2 does not work on iOS 10,13421,Unanswered,2020-05-27T03:17:45Z,,,Versions
eclipse-theia/theia,https://github.com/eclipse-theia/theia/discussions/8176,ElectronTokenBackendContribution may add a whitelist config that does not need to carry tokens.,8176,Answered,2020-07-15T11:24:33Z,,,Errors
vercel/next.js,https://github.com/vercel/next.js/discussions/11764,Link passHref issue with Emotion,11764,Answered,2020-04-09T00:31:47Z,,,Errors
laravel/framework,https://github.com/laravel/framework/discussions/33133,Custom Inflector pluralizations.,33133,Unanswered,2020-06-06T22:59:50Z,,,Versions
vercel/next.js,https://github.com/vercel/next.js/discussions/13531,Do I need to make graphql server to https?,13531,Unanswered,2020-05-29T03:49:07Z,,,Errors
vercel/next.js,https://github.com/vercel/next.js/discussions/14337,Problem with Loading Global CSS in Docker APP,14337,Unanswered,2020-06-18T20:53:46Z,🙏,Help,Errors
react-spring/react-spring,https://github.com/react-spring/react-spring/discussions/928,Scrolling a list using <Transition />,928,Unanswered,2020-02-05T22:24:22Z,,,Usage
ionic-team/capacitor,https://github.com/ionic-team/capacitor/discussions/1286,No matching client found for package name 'capacitor.android.plugins',1286,Unanswered,2019-03-04T09:41:30Z,🙏,Help,Errors
spatie/laravel-backup,https://github.com/spatie/laravel-backup/discussions/1095,mysql Dump Issue,1095,Unanswered,2020-07-12T12:51:04Z,🙏,Help,Errors
strapi/strapi,https://github.com/strapi/strapi/discussions/6077,users-permissions/permissions endpoint is pointless,6077,Unanswered,2020-05-05T16:17:43Z,,,Conceptual
graphql/graphiql,https://github.com/graphql/graphiql/discussions/954,Discussion: Editor and Documentation Accessibility,954,Unanswered,2019-09-05T20:52:52Z,,,Conceptual
codesandbox/codesandbox-client,https://github.com/codesandbox/codesandbox-client/discussions/2270,How to configure custom Esc for insert mode in Vim Mode for iPad?,2270,Unanswered,2019-08-09T20:42:28Z,,,Usage
apache/couchdb,https://github.com/apache/couchdb/discussions/2994,You are not a server admin.,2994,Answered,2020-07-10T18:08:32Z,🙏,Help,Errors
spatie/laravel-backup,https://github.com/spatie/laravel-backup/discussions/1044,Help - Muliple Backup configurations,1044,Unanswered,2020-02-28T10:22:00Z,🙏,Help,Discrepancy
apollographql/apollo-client,https://github.com/apollographql/apollo-client/discussions/6228,Caching one Object at a Time in a Collection,6228,Unanswered,2020-05-01T21:59:22Z,,,Conceptual
prisma/prisma,https://github.com/prisma/prisma/discussions/2059,Eager Relations,2059,Answered,2020-04-02T11:17:56Z,,,Conceptual
vercel/next.js,https://github.com/vercel/next.js/discussions/13152,Ability to opt in/out of Incremental Static Regeneration on a per route basis on dynamic route group,13152,Answered,2020-05-20T16:52:09Z,,,Conceptual
scrumpy/tiptap,https://github.com/ueberdosis/tiptap/discussions/615,Is there a hover option?,615,Unanswered,2020-02-25T22:06:18Z,,,Discrepancy
strapi/strapi,https://github.com/strapi/strapi/discussions/5828,My wishes for media library improvement,5828,Answered,2020-04-16T14:38:45Z,,,Conceptual
strapi/strapi,https://github.com/strapi/strapi/discussions/7090,Upload file during plugin entry creation,7090,Answered,2020-07-20T19:11:39Z,,,Conceptual
apollographql/apollo-client,https://github.com/apollographql/apollo-client/discussions/6127,Subscriptions & optimistic updates,6127,Unanswered,2020-04-08T12:01:49Z,,,Conceptual
dotansimha/graphql-code-generator,https://github.com/dotansimha/graphql-code-generator/discussions/3517,[Plugin Request] Babel Blade Codegen,3517,Unanswered,2020-02-17T17:26:06Z,,,Information
tannerlinsley/react-query,https://github.com/tannerlinsley/react-query/discussions/331,Clear and refetch?,331,Answered,2020-04-08T16:35:40Z,,,Review
laravel/framework,https://github.com/laravel/framework/discussions/33526,external domain emails not being sent.,33526,Unanswered,2020-07-13T18:14:33Z,,,Discrepancy
ionic-team/capacitor,https://github.com/ionic-team/capacitor/discussions/2807,Build CommonJS instead of ES6,2807,Unanswered,2020-04-21T08:44:44Z,🤔,Ideas,Conceptual
vercel/next.js,https://github.com/vercel/next.js/discussions/13793,Cannot profile production build,13793,Unanswered,2020-06-05T07:20:16Z,,,Conceptual
vercel/next.js,https://github.com/vercel/next.js/discussions/14044,Console error after upgrade.,14044,Answered,2020-06-10T22:08:44Z,,,Errors
starship/starship,https://github.com/starship/starship/discussions/580,Question on performance,580,Unanswered,2019-10-23T00:21:27Z,,,Learning
strapi/strapi,https://github.com/strapi/strapi/discussions/5955,Relation usage,5955,Answered,2020-04-25T23:36:07Z,,,Discrepancy
adonisjs/core,https://github.com/adonisjs/core/discussions/1268,Seeds not executing,1268,Answered,2020-07-19T11:42:47Z,🙏,Help,Errors
vercel/next.js,https://github.com/vercel/next.js/discussions/11511,"Cannot suppress ""Module not found: Can't resolve"" warning",11511,Unanswered,2020-03-31T07:23:17Z,,,Errors
ardatan/graphql-tools,https://github.com/ardatan/graphql-tools/discussions/1145,Any way to mock input variables?,1145,Unanswered,2019-06-07T15:12:11Z,,,Learning
blitz-js/blitz,https://github.com/blitz-js/blitz/discussions/325,[RFC] Add Form & Field components to new app template,325,Unanswered,2020-04-29T02:59:48Z,,,Conceptual
apache/couchdb,https://github.com/apache/couchdb/discussions/2216,"Query Protocol: reset comes after initialization, but before use",2216,Unanswered,2019-10-01T22:52:13Z,🙏,Help,Errors
davidkpiano/xstate,https://github.com/davidkpiano/xstate/discussions/1209,useService performance recommendations,1209,Unanswered,2020-05-28T00:46:37Z,,,Review
facebook/create-react-app,https://github.com/facebook/create-react-app/discussions/9092,Measurement of build time,9092,Unanswered,2020-05-30T03:53:02Z,🙏,Help,Usage
apollographql/apollo-client,https://github.com/apollographql/apollo-client/discussions/6147,__typename has been injected into my update mutation and it causes query to fail,6147,Unanswered,2020-04-14T00:48:07Z,,,Errors
dotansimha/graphql-code-generator,https://github.com/dotansimha/graphql-code-generator/discussions/1850,[Plugin Request] Flow + `react-apollo` generator,1850,Unanswered,2019-05-12T16:02:48Z,,,Plans
dotansimha/graphql-code-generator,https://github.com/dotansimha/graphql-code-generator/discussions/1772,[Plugin Request] Scaffolding resolvers,1772,Unanswered,2019-04-25T11:48:20Z,,,Plans
strapi/strapi,https://github.com/strapi/strapi/discussions/5456,Start / build and SOA : Add an option to ingore webpackage of strapi-admin for specific env,5456,Unanswered,2020-03-07T00:34:29Z,,,Conceptual
apache/couchdb,https://github.com/apache/couchdb/discussions/2989,CPU overload and instability when running 3.1.0 with .compact files from earlier versions.,2989,Answered,2020-07-07T12:47:20Z,🙏,Help,Versions
vercel/next.js,https://github.com/vercel/next.js/discussions/14328,npm run build fails when internet is not solid enough,14328,Unanswered,2020-06-18T16:32:09Z,🙏,Help,Errors
apollographql/apollo-client,https://github.com/apollographql/apollo-client/discussions/6293,Improving the local state management: @export directive on server side fields or accessing grandparent values in local resolvers,6293,Unanswered,2020-05-16T17:24:46Z,,,Plans
strapi/strapi,https://github.com/strapi/strapi/discussions/6603,MongoDB 100% CPU issue,6603,Answered,2020-06-09T13:15:22Z,,,Errors
strapi/strapi,https://github.com/strapi/strapi/discussions/5871,http://localhost:1337/graphql/ don't work,5871,Answered,2020-04-19T07:52:06Z,,,Errors
vercel/next.js,https://github.com/vercel/next.js/discussions/13119,getting 403 because of quarantined issue in use-subscription-1.4.1.tgz,13119,Unanswered,2020-05-19T22:44:00Z,,,Errors
prisma/prisma,https://github.com/prisma/prisma/discussions/2969,Import types only for front-end code,2969,Unanswered,2020-07-08T15:56:58Z,🙏,Help,Errors
vercel/next.js,https://github.com/vercel/next.js/discussions/11596,"Same chunk added with link rel=""prefetch"" and with rel=""preload""",11596,Unanswered,2020-04-02T11:27:13Z,,,Review
vercel/next.js,https://github.com/vercel/next.js/discussions/13491,Hi this is a major bugs!!,13491,Unanswered,2020-05-28T11:13:39Z,,,Discrepancy
eclipse-theia/theia,https://github.com/eclipse-theia/theia/discussions/8085,Showing the Output Channel after Debug Console does not refocus,8085,Unanswered,2020-06-24T17:32:15Z,,,Review
concourse/concourse,https://github.com/concourse/concourse/discussions/5570,iptables blocking fly port results in no error message and app crash,5570,Unanswered,2020-05-08T12:37:34Z,,,Discrepancy
vercel/next.js,https://github.com/vercel/next.js/discussions/14836,"next is incompatible with ""ow""",14836,Unanswered,2020-07-04T00:27:28Z,🙏,Help,Errors
vercel/next.js,https://github.com/vercel/next.js/discussions/14333,Nested SCSS is not working for scoped SCSS.,14333,Answered,2020-06-18T19:47:08Z,🙏,Help,Errors
ionic-team/capacitor,https://github.com/ionic-team/capacitor/discussions/2752,Setting repeatable notifications on a specific day?,2752,Unanswered,2020-04-12T19:34:14Z,🙏,Help,Review
dotnet/aspnetcore,https://github.com/dotnet/aspnetcore/discussions/22699,Rewrite the Route after UseRouting was called inside a middle-ware,22699,Unanswered,2020-06-09T12:51:37Z,,,Review
meilisearch/MeiliSearch,https://github.com/meilisearch/MeiliSearch/discussions/668,Why don't have a rust api for meilisearch,668,Answered,2020-05-10T03:14:01Z,,,Conceptual
xamarin/Xamarin.Forms,https://github.com/xamarin/Xamarin.Forms/discussions/11338,[Enhancement] CollectionView Body,11338,Unanswered,2020-07-07T10:09:18Z,,,Conceptual
spatie/laravel-medialibrary,https://github.com/spatie/laravel-medialibrary/discussions/1939,Switched ids in AWS storage,1939,Unanswered,2020-06-22T11:57:51Z,🙏,Help,Discrepancy
vercel/next.js,https://github.com/vercel/next.js/discussions/14744,Cannot execute create-next-app because of permission,14744,Unanswered,2020-06-30T18:40:47Z,🤔,Ideas,Errors
meilisearch/MeiliSearch,https://github.com/meilisearch/MeiliSearch/discussions/803,Uninstall/remove Meilisearch,803,Answered,2020-06-28T18:44:46Z,,,Discrepancy
vercel/next.js,https://github.com/vercel/next.js/discussions/11281,Return redirect from getServerSideProps,11281,Answered,2020-03-22T21:39:59Z,,,Conceptual
graphql/graphiql,https://github.com/graphql/graphiql/discussions/1444,Discussion: New features/UX changes for playground in addition to it's existing features?,1444,Unanswered,2020-04-01T18:18:37Z,,,Conceptual
containrrr/watchtower,https://github.com/containrrr/watchtower/discussions/568,"run-once parameter executes multiple times, does not stop, does not give out info mails",568,Answered,2020-06-04T11:31:08Z,🙏,Help,Errors
tannerlinsley/react-table,https://github.com/tannerlinsley/react-table/discussions/2144,Text strings must be rendered within a <Text> component,2144,Answered,2020-04-12T20:32:28Z,,,Errors
tokio-rs/tokio,https://github.com/tokio-rs/tokio/discussions/2653,Using futures::executor::block_on inside Tokio,2653,Answered,2020-07-10T12:32:03Z,,,Errors
aws-amplify/amplify-js,https://github.com/aws-amplify/amplify-js/discussions/5617,React Native Typescript Issues,5617,Unanswered,2020-04-29T14:56:34Z,,,Errors
gulpjs/gulp,https://github.com/gulpjs/gulp/discussions/2452,Gulp src not matching nested directories,2452,Unanswered,2020-06-09T18:42:33Z,🙏,Help,Review
laravel/framework,https://github.com/laravel/framework/discussions/33070,How should we use the new Doctrine Inflector rules?,33070,Unanswered,2020-06-02T15:27:58Z,,,Usage
tannerlinsley/react-table,https://github.com/tannerlinsley/react-table/discussions/2190,Table column widths are not working without a non-resizable column,2190,Unanswered,2020-04-17T19:31:22Z,,,Discrepancy
strapi/strapi,https://github.com/strapi/strapi/discussions/6963,Taking NODE_ENV by default without checking it is risky and leads to errors and infinite frustrations,6963,Unanswered,2020-07-10T08:11:59Z,,,Errors
vercel/next.js,https://github.com/vercel/next.js/discussions/11171,SEO optimizable routes with dynamic routing,11171,Answered,2020-03-18T13:07:19Z,,,Review
strapi/strapi,https://github.com/strapi/strapi/discussions/6622,Setup Cloudfront url for AWS S3 provider ?What about new version of strapi. Because settings button is hidden,6622,Unanswered,2020-06-10T21:32:27Z,,,Versions
scrumpy/tiptap,https://github.com/ueberdosis/tiptap/discussions/671,Support for different types of ListItem,671,Unanswered,2020-04-17T10:35:45Z,,,Usage
nlohmann/json,https://github.com/nlohmann/json/discussions/2223,How to simplify the task of write to_json function for derived class ?,2223,Answered,2020-06-27T08:42:15Z,🙏,Help,Review
ionic-team/capacitor,https://github.com/ionic-team/capacitor/discussions/1748,How to write an Electron plugin?,1748,Unanswered,2019-07-09T13:33:51Z,🙏,Help,Usage
vercel/next.js,https://github.com/vercel/next.js/discussions/14490,"""Cannot resolve module 'fs'"" inside static component methods",14490,Unanswered,2020-06-23T11:14:06Z,🙏,Help,Errors
vercel/next.js,https://github.com/vercel/next.js/discussions/12297,Remounting shared layout when using route params,12297,Unanswered,2020-04-28T22:46:04Z,,,Errors
apollographql/apollo-client,https://github.com/apollographql/apollo-client/discussions/6148,"Apollo Client InMemoryCache, What are all the things that affect InMemoryCache and network requests?",6148,Unanswered,2020-04-14T19:56:21Z,,,Conceptual
tannerlinsley/react-query,https://github.com/tannerlinsley/react-query/discussions/359,Pattern for transforming and sharing data and about pagination,359,Unanswered,2020-04-16T13:45:59Z,,,Review
concourse/concourse,https://github.com/concourse/concourse/discussions/5848,fly sync from v5.8.1 to v6.3.0 issue,5848,Unanswered,2020-07-06T15:26:08Z,🙏,Help,Versions
linkerd/linkerd2,https://github.com/linkerd/linkerd2/discussions/4477,Metrics update period in Linkerd proxy,4477,Answered,2020-05-24T00:25:02Z,,,Usage
parcel-bundler/parcel,https://github.com/parcel-bundler/parcel/discussions/3377,🚀 Help test the Parcel 2 prerelease,3377,Unanswered,2019-08-13T17:21:46Z,,,Announcement
tailwindcss/tailwindcss,https://github.com/tailwindcss/tailwindcss/discussions/1504,Where do fonts in tailwindui themes come from?,1504,Answered,2020-03-28T23:55:31Z,,,Conceptual
linkerd/linkerd2,https://github.com/linkerd/linkerd2/discussions/4616,Pods unable to connect to API Server after enabling linkerd,4616,Unanswered,2020-06-16T22:16:35Z,,,Errors
tannerlinsley/react-query,https://github.com/tannerlinsley/react-query/discussions/426,`status` should not be `success` when passing a falsy query key,426,Answered,2020-04-30T15:22:13Z,,,Conceptual
xamarin/Xamarin.Forms,https://github.com/xamarin/Xamarin.Forms/discussions/11201,[Enhancement] CarouselView circular,11201,Answered,2020-06-25T12:26:52Z,,,Usage
spatie/laravel-medialibrary,https://github.com/spatie/laravel-medialibrary/discussions/1849,installation fail v8 in php 7 laravel 7,1849,Unanswered,2020-04-25T07:14:26Z,🙏,Help,Versions
vercel/next.js,https://github.com/vercel/next.js/discussions/14422,nextjs/dynamic not supported with external packages,14422,Unanswered,2020-06-21T20:00:09Z,🙏,Help,Review
babel/babel,https://github.com/babel/babel/discussions/11694,How to correctly remove Flow types in a React Native Web project?,11694,Answered,2020-06-08T18:44:13Z,🙏,Help,Review
strapi/strapi,https://github.com/strapi/strapi/discussions/5882,Allow creation of a content type entry from within related content type,5882,Answered,2020-04-20T12:29:15Z,,,Conceptual
eclipse-theia/theia,https://github.com/eclipse-theia/theia/discussions/7728,Setting default height for ViewContainerPart,7728,Answered,2020-05-03T12:43:44Z,,,Usage
apollographql/apollo-client,https://github.com/apollographql/apollo-client/discussions/6366,Fragment based dynamic component rendering,6366,Unanswered,2020-05-30T08:17:56Z,,,Conceptual
tannerlinsley/react-query,https://github.com/tannerlinsley/react-query/discussions/329,Does react-query act as a state management library? Can I use it with Redux?,329,Answered,2020-04-08T13:51:59Z,,,Learning
linkerd/linkerd2,https://github.com/linkerd/linkerd2/discussions/4617,Disabling meshing of the linkerd containers by default,4617,Unanswered,2020-06-16T23:38:09Z,,,Usage
strapi/strapi,https://github.com/strapi/strapi/discussions/6104,Deprecated dependencies,6104,Unanswered,2020-05-07T12:16:27Z,,,Errors
vercel/next.js,https://github.com/vercel/next.js/discussions/14591,Decentral Microfrontend support,14591,Unanswered,2020-06-26T15:00:26Z,🤔,Ideas,Conceptual
spatie/laravel-backup,https://github.com/spatie/laravel-backup/discussions/1064,Cleanup Process is Quite difficult to implement in my project.,1064,Unanswered,2020-04-24T10:56:04Z,🙏,Help,Review
davidkpiano/xstate,https://github.com/davidkpiano/xstate/discussions/552,📚 Docs Wish List,552,Unanswered,2019-07-17T04:25:52Z,,,Conceptual
vercel/next.js,https://github.com/vercel/next.js/discussions/13321,newly uploaded images will not show in background-image after build,13321,Unanswered,2020-05-24T18:11:11Z,,,Errors
prisma/prisma,https://github.com/prisma/prisma/discussions/2095,"Does prisma 2 support group by, and complex queries ?",2095,Unanswered,2020-04-04T19:41:05Z,,,Conceptual
laravel/framework,https://github.com/laravel/framework/discussions/33503,Load() and with() functions act inconsistent when using relationships inside relationships,33503,Answered,2020-07-10T17:43:04Z,,,Conceptual
vercel/next.js,https://github.com/vercel/next.js/discussions/13002,Unable to select query when special characters are present,13002,Unanswered,2020-05-17T09:40:05Z,,,Usage
spatie/laravel-backup,https://github.com/spatie/laravel-backup/discussions/1075,Backup fails on schedule,1075,Unanswered,2020-05-29T17:37:45Z,,,Errors
strapi/strapi,https://github.com/strapi/strapi/discussions/6026,Install Strapi in Cloudways (managed hosting) - Cannot access admin,6026,Answered,2020-05-01T17:14:43Z,,,Errors
google/jax,https://github.com/google/jax/discussions/3799,Announcing Elegy!,3799,Answered,2020-07-20T03:09:40Z,,,Announcement
containerd/containerd,https://github.com/containerd/containerd/discussions/4350,Unable to run containerd example inside a Docker container,4350,Answered,2020-06-29T16:25:22Z,,,Learning